[
  {
    "fips": "12001",
    "county": "County 12001",
    "state": "FL",
    "region": "North Florida",
    "metroStatus": "Metro",
    "sizeBucket": "Large",
    "year": 2025,
    "provisional": true,
    "totalPopulation": 852820,
    "totalBirths": 11086,
    "crudeBirthRate": 13.0,
    "fertilityRate": 55.0,
    "birthsChange1y": -3.0,
    "birthsChange5y": 13.0,
    "birthsChange10y": 11.0,
    "under5Population": 63961,
    "schoolAgePopulation": 127923,
    "netDomesticMigration": -1680,
    "populationGrowthRate": 0.2,
    "enrollmentTotal": 85964,
    "enrollmentChange5y": 2.0,
    "kindergartenEnrollment": 8187,
    "kindergartenChange5y": 0.0
  },
  {
    "fips": "12003",
    "county": "County 12003",
    "state": "FL",
    "region": "North Florida",
    "metroStatus": "Non-metro",
    "sizeBucket": "Large",
    "year": 2025,
    "provisional": true,
    "totalPopulation": 266849,
    "totalBirths": 2641,
    "crudeBirthRate": 9.9,
    "fertilityRate": 73.9,
    "birthsChange1y": -0.5,
    "birthsChange5y": 4.4,
    "birthsChange10y": -7.6,
    "under5Population": 21081,
    "schoolAgePopulation": 47765,
    "netDomesticMigration": 3349,
    "populationGrowthRate": 2.49,
    "enrollmentTotal": 25937,
    "enrollmentChange5y": 3.4,
    "kindergartenEnrollment": 2561,
    "kindergartenChange5y": 1.4
  },
  {
    "fips": "12005",
    "county": "County 12005",
    "state": "FL",
    "region": "North Florida",
    "metroStatus": "Non-metro",
    "sizeBucket": "Large",
    "year": 2025,
    "provisional": true,
    "totalPopulation": 644351,
    "totalBirths": 5863,
    "crudeBirthRate": 9.1,
    "fertilityRate": 72.1,
    "birthsChange1y": 1.5,
    "birthsChange5y": 14.5,
    "birthsChange10y": 27.5,
    "under5Population": 45748,
    "schoolAgePopulation": 84409,
    "netDomesticMigration": -149,
    "populationGrowthRate": 6.51,
    "enrollmentTotal": 67270,
    "enrollmentChange5y": 3.6,
    "kindergartenEnrollment": 6185,
    "kindergartenChange5y": 1.6
  },
  {
    "fips": "12007",
    "county": "County 12007",
    "state": "FL",
    "region": "North Florida",
    "metroStatus": "Non-metro",
    "sizeBucket": "Large",
    "year": 2025,
    "provisional": true,
    "totalPopulation": 367497,
    "totalBirths": 2829,
    "crudeBirthRate": 7.7,
    "fertilityRate": 74.7,
    "birthsChange1y": -2.1,
    "birthsChange5y": 6.9,
    "birthsChange10y": -15.2,
    "under5Population": 20947,
    "schoolAgePopulation": 65046,
    "netDomesticMigration": -1003,
    "populationGrowthRate": 3.97,
    "enrollmentTotal": 35720,
    "enrollmentChange5y": 10.9,
    "kindergartenEnrollment": 3527,
    "kindergartenChange5y": 8.9
  },
  {
    "fips": "12009",
    "county": "County 12009",
    "state": "FL",
    "region": "North Florida",
    "metroStatus": "Non-metro",
    "sizeBucket": "Large",
    "year": 2025,
    "provisional": true,
    "totalPopulation": 567167,
    "totalBirths": 4367,
    "crudeBirthRate": 7.7,
    "fertilityRate": 65.7,
    "birthsChange1y": 0.3,
    "birthsChange5y": 10.4,
    "birthsChange10y": 8.4,
    "under5Population": 32328,
    "schoolAgePopulation": 83373,
    "netDomesticMigration": 2667,
    "populationGrowthRate": 2.67,
    "enrollmentTotal": 59212,
    "enrollmentChange5y": -5.7,
    "kindergartenEnrollment": 5444,
    "kindergartenChange5y": -7.7
  },
  {
    "fips": "12011",
    "county": "County 12011",
    "state": "FL",
    "region": "North Florida",
    "metroStatus": "Non-metro",
    "sizeBucket": "Medium",
    "year": 2025,
    "provisional": true,
    "totalPopulation": 194621,
    "totalBirths": 1576,
    "crudeBirthRate": 8.1,
    "fertilityRate": 67.1,
    "birthsChange1y": -3.0,
    "birthsChange5y": -6.9,
    "birthsChange10y": -18.9,
    "under5Population": 11871,
    "schoolAgePopulation": 29387,
    "netDomesticMigration": 1121,
    "populationGrowthRate": 0.21,
    "enrollmentTotal": 19851,
    "enrollmentChange5y": -8.0,
    "kindergartenEnrollment": 1868,
    "kindergartenChange5y": -9.9
  },
  {
    "fips": "12013",
    "county": "County 12013",
    "state": "FL",
    "region": "North Florida",
    "metroStatus": "Non-metro",
    "sizeBucket": "Large",
    "year": 2025,
    "provisional": true,
    "totalPopulation": 504026,
    "totalBirths": 4334,
    "crudeBirthRate": 8.6,
    "fertilityRate": 71.6,
    "birthsChange1y": -0.7,
    "birthsChange5y": -6.7,
    "birthsChange10y": -28.7,
    "under5Population": 33265,
    "schoolAgePopulation": 78628,
    "netDomesticMigration": 6526,
    "populationGrowthRate": 4.26,
    "enrollmentTotal": 49596,
    "enrollmentChange5y": -12.7,
    "kindergartenEnrollment": 4838,
    "kindergartenChange5y": -14.7
  },
  {
    "fips": "12015",
    "county": "County 12015",
    "state": "FL",
    "region": "North Florida",
    "metroStatus": "Non-metro",
    "sizeBucket": "Small",
    "year": 2025,
    "provisional": true,
    "totalPopulation": 62863,
    "totalBirths": 647,
    "crudeBirthRate": 10.29,
    "fertilityRate": 51.3,
    "birthsChange1y": 0.2,
    "birthsChange5y": 15.1,
    "birthsChange10y": -6.9,
    "under5Population": 5217,
    "schoolAgePopulation": 8989,
    "netDomesticMigration": 2363,
    "populationGrowthRate": 2.63,
    "enrollmentTotal": 6562,
    "enrollmentChange5y": 4.1,
    "kindergartenEnrollment": 603,
    "kindergartenChange5y": 2.1
  },
  {
    "fips": "12017",
    "county": "County 12017",
    "state": "FL",
    "region": "North Florida",
    "metroStatus": "Non-metro",
    "sizeBucket": "Large",
    "year": 2025,
    "provisional": true,
    "totalPopulation": 674959,
    "totalBirths": 9381,
    "crudeBirthRate": 13.9,
    "fertilityRate": 60.9,
    "birthsChange1y": 2.0,
    "birthsChange5y": 9.9,
    "birthsChange10y": -2.1,
    "under5Population": 56696,
    "schoolAgePopulation": 93819,
    "netDomesticMigration": -2541,
    "populationGrowthRate": 6.59,
    "enrollmentTotal": 70465,
    "enrollmentChange5y": 8.9,
    "kindergartenEnrollment": 6479,
    "kindergartenChange5y": 6.9
  },
  {
    "fips": "12019",
    "county": "County 12019",
    "state": "FL",
    "region": "North Florida",
    "metroStatus": "Non-metro",
    "sizeBucket": "Large",
    "year": 2025,
    "provisional": true,
    "totalPopulation": 439950,
    "totalBirths": 3959,
    "crudeBirthRate": 9.0,
    "fertilityRate": 72.0,
    "birthsChange1y": 2.5,
    "birthsChange5y": 14.5,
    "birthsChange10y": 7.5,
    "under5Population": 30796,
    "schoolAgePopulation": 57193,
    "netDomesticMigration": 5450,
    "populationGrowthRate": -0.5,
    "enrollmentTotal": 45402,
    "enrollmentChange5y": 8.5,
    "kindergartenEnrollment": 4223,
    "kindergartenChange5y": 6.5
  },
  {
    "fips": "12021",
    "county": "County 12021",
    "state": "FL",
    "region": "North Florida",
    "metroStatus": "Non-metro",
    "sizeBucket": "Small",
    "year": 2025,
    "provisional": true,
    "totalPopulation": 84153,
    "totalBirths": 614,
    "crudeBirthRate": 7.3,
    "fertilityRate": 76.3,
    "birthsChange1y": -3.4,
    "birthsChange5y": -0.4,
    "birthsChange10y": -22.4,
    "under5Population": 4460,
    "schoolAgePopulation": 11192,
    "netDomesticMigration": 653,
    "populationGrowthRate": 5.53,
    "enrollmentTotal": 8179,
    "enrollmentChange5y": -6.3,
    "kindergartenEnrollment": 807,
    "kindergartenChange5y": -8.3
  },
  {
    "fips": "12023",
    "county": "County 12023",
    "state": "FL",
    "region": "North Florida",
    "metroStatus": "Non-metro",
    "sizeBucket": "Large",
    "year": 2025,
    "provisional": true,
    "totalPopulation": 614682,
    "totalBirths": 7499,
    "crudeBirthRate": 12.2,
    "fertilityRate": 57.2,
    "birthsChange1y": -2.9,
    "birthsChange5y": 16.1,
    "birthsChange10y": -15.9,
    "under5Population": 41183,
    "schoolAgePopulation": 99578,
    "netDomesticMigration": 4182,
    "populationGrowthRate": 3.82,
    "enrollmentTotal": 60484,
    "enrollmentChange5y": -4.9,
    "kindergartenEnrollment": 5900,
    "kindergartenChange5y": -6.9
  },
  {
    "fips": "12025",
    "county": "County 12025",
    "state": "FL",
    "region": "North Florida",
    "metroStatus": "Metro",
    "sizeBucket": "Large",
    "year": 2025,
    "provisional": true,
    "totalPopulation": 842656,
    "totalBirths": 8932,
    "crudeBirthRate": 10.6,
    "fertilityRate": 46.6,
    "birthsChange1y": 1.8,
    "birthsChange5y": 4.8,
    "birthsChange10y": -17.2,
    "under5Population": 42975,
    "schoolAgePopulation": 114601,
    "netDomesticMigration": 156,
    "populationGrowthRate": 6.56,
    "enrollmentTotal": 80894,
    "enrollmentChange5y": -6.2,
    "kindergartenEnrollment": 8089,
    "kindergartenChange5y": -8.2
  },
  {
    "fips": "12027",
    "county": "County 12027",
    "state": "FL",
    "region": "North Florida",
    "metroStatus": "Metro",
    "sizeBucket": "Large",
    "year": 2025,
    "provisional": true,
    "totalPopulation": 580284,
    "totalBirths": 7195,
    "crudeBirthRate": 12.4,
    "fertilityRate": 73.4,
    "birthsChange1y": 2.2,
    "birthsChange5y": 16.2,
    "birthsChange10y": 4.2,
    "under5Population": 40039,
    "schoolAgePopulation": 95166,
    "netDomesticMigration": 1784,
    "populationGrowthRate": 4.84,
    "enrollmentTotal": 58492,
    "enrollmentChange5y": 0.2,
    "kindergartenEnrollment": 5570,
    "kindergartenChange5y": -1.8
  },
  {
    "fips": "12029",
    "county": "County 12029",
    "state": "FL",
    "region": "North Florida",
    "metroStatus": "Non-metro",
    "sizeBucket": "Large",
    "year": 2025,
    "provisional": true,
    "totalPopulation": 754866,
    "totalBirths": 8001,
    "crudeBirthRate": 10.6,
    "fertilityRate": 75.6,
    "birthsChange1y": 1.3,
    "birthsChange5y": 15.3,
    "birthsChange10y": -26.7,
    "under5Population": 38498,
    "schoolAgePopulation": 110210,
    "netDomesticMigration": 6366,
    "populationGrowthRate": 4.66,
    "enrollmentTotal": 74278,
    "enrollmentChange5y": 4.3,
    "kindergartenEnrollment": 7246,